{
  "version": "0.1", "backend": "github", "base_url": "https://api.github.com", "sovereign": false,
  "auth": { "model": "ci-minted-app-token", "token_ref": "secret://ci/GH_OPS_APP_TOKEN", "scopes": ["repo:read", "issues:write", "pull_requests:write"] },
  "capabilities": [
    { "op": "list_repositories", "method": "GET", "endpoint": "/orgs/{org}/repos", "consent_purpose": "discover" },
    { "op": "ci_status", "method": "GET", "endpoint": "/repos/{owner}/{repo}/commits/{ref}/check-runs", "consent_purpose": "discover" },
    { "op": "security_alerts", "method": "GET", "endpoint": "/repos/{owner}/{repo}/dependabot/alerts", "consent_purpose": "discover" },
    { "op": "activity", "method": "GET", "endpoint": "/repos/{owner}/{repo}", "consent_purpose": "discover" },
    { "op": "ownership", "method": "GET", "endpoint": "/repos/{owner}/{repo}/contents/CODEOWNERS", "consent_purpose": "discover" },
    { "op": "create_issue_draft", "method": "POST", "endpoint": "/repos/{owner}/{repo}/issues", "mutating": true, "consent_purpose": "ship" },
    { "op": "create_mr_draft", "method": "POST", "endpoint": "/repos/{owner}/{repo}/pulls", "mutating": true, "consent_purpose": "ship" },
    { "op": "apply_labels", "method": "POST", "endpoint": "/repos/{owner}/{repo}/issues/{n}/labels", "mutating": true, "consent_purpose": "administer" }
  ]
}
